{
  "$schema": "https://json-schema.org/draft/2020-12/schema",
  "$id": "https://github.com/FirefoxUX/acorn-contracts/component-api/schema.json",
  "title": "Component API entry",
  "description": "Schema for one component-api/<id>.json file. See component-api/README.md for the full field-by-field rationale, this file is the machine-checkable version of that same schema.",
  "type": "object",
  "required": [
    "id",
    "description",
    "implementation"
  ],
  "additionalProperties": false,
  "properties": {
    "id": {
      "type": "string",
      "description": "Stable slug, matches index.html's DATA array id and the same-named guidance-api/token-api entries. Never null."
    },
    "summary": {
      "type": "string",
      "description": "One plain-language sentence, no implementation detail, for someone who wants to know what the thing is before reading the technical description."
    },
    "tagName": {
      "type": [
        "string",
        "null"
      ],
      "description": "The real, registered custom element tag name, if one exists. null for none/missing kinds, and sometimes for modern/classic kinds where no distinct tag was ever registered. A dual-kind entry may record both real tags in one string (e.g. \"button (classic) / moz-button (modern)\")."
    },
    "description": {
      "type": "string",
      "description": "One or two sentences, grounded in the actual source file, not a generic restatement of the component's name."
    },
    "implementation": {
      "type": "object",
      "required": [
        "kind"
      ],
      "additionalProperties": false,
      "properties": {
        "kind": {
          "type": "string",
          "enum": [
            "modern",
            "classic",
            "none",
            "missing",
            "dual"
          ]
        },
        "file": {
          "type": "string",
          "description": "Path relative to the mozilla-central root, and nothing else: the primary source-of-truth file this JSON was derived from. Absent when `kind` is `missing`, because no such file exists; what does exist instead is described in `description`. Where a component genuinely spans two implementations the primary one goes here and the other is named in the description, so this field stays parseable as a single path."
        },
        "verifiedAt": {
          "type": "object",
          "description": "When this entry's contents were last confirmed against real upstream source, as opposed to when the JSON was last edited here (that is _meta.json's job). Optional and deliberately not backfilled: an absent verifiedAt means nobody has confirmed this entry since the field existed, which is the honest answer for most of the inventory. Set it only after actually reading the cited source, never from a hash comparison or a name-presence check, both of which catch removals and miss semantic change.",
          "required": [
            "commit",
            "date"
          ],
          "additionalProperties": false,
          "properties": {
            "commit": {
              "type": "string",
              "description": "Full mozilla-central commit SHA the entry was read against."
            },
            "date": {
              "type": "string",
              "description": "ISO date the reading happened, YYYY-MM-DD."
            },
            "scope": {
              "type": "string",
              "enum": [
                "full",
                "implementation"
              ],
              "description": "full: every documented member was checked against source. implementation: only the kind/file/tagName line was confirmed. Absent means full."
            }
          }
        },
        "codeConnect": {
          "type": "string",
          "description": "Path to this component's Figma Code Connect file, relative to the mozilla-central root, when one exists. A path rather than a boolean so it is checkable: if the file moves upstream, check-drift.py reports it the same way it reports a moved implementation file. Absent means no Code Connect file, which also means this component has no second source that can contradict the contract."
        }
      }
    },
    "attributes": {
      "type": "array",
      "items": {
        "type": "object",
        "required": [
          "name",
          "description"
        ],
        "additionalProperties": false,
        "properties": {
          "name": {
            "type": "string"
          },
          "type": {
            "type": "object",
            "description": "CEM's own Type object, not a bare string. `text` is the full type as written in whatever syntax the source uses, so an enumerated attribute is a TypeScript-style union. Note that Lit only declares `{ type: String }`, so a union here is this contract asserting the legal set, not a fact recovered from the source.",
            "required": [
              "text"
            ],
            "additionalProperties": false,
            "properties": {
              "text": {
                "type": "string"
              }
            }
          },
          "description": {
            "type": "string"
          },
          "default": {
            "type": "string",
            "description": "CEM's own field name. This attribute's real default value/state when not otherwise set. Omitted, not guessed, when source doesn't establish one explicitly."
          },
          "figmaConfig": {
            "type": "boolean",
            "description": "Whether this attribute is real user-facing configuration vs. internal/plumbing-only state. Omitted, not guessed, when genuinely unclear."
          },
          "deprecated": {
            "type": [
              "string",
              "boolean"
            ],
            "description": "CEM's own field name. Whether this member is deprecated; a string is the reason. Note CEM has no per-VALUE deprecation, so a legacy value of an enumerated attribute stays described in prose, not marked here."
          },
          "inheritedFrom": {
            "type": "object",
            "description": "CEM's own field name. A Reference to the class that declares this member, as opposed to the component it is documented on. CEM's Reference holds one name, so an intermediate hop stays in the description: `label` on input-password is declared by MozBaseInputElement and reaches it via MozInputText, and only the declaring class goes here. The chain itself is CEM's superclass/mixins on a class declaration, which this schema does not model.",
            "required": [
              "name"
            ],
            "additionalProperties": false,
            "properties": {
              "name": {
                "type": "string",
                "description": "The exported class name, e.g. MozBaseInputElement."
              },
              "module": {
                "type": "string",
                "description": "Path relative to the mozilla-central root."
              },
              "package": {
                "type": "string",
                "description": "Only for a global like HTMLElement, where CEM uses \"global:\"."
              }
            }
          }
        }
      }
    },
    "slots": {
      "type": "array",
      "items": {
        "type": "object",
        "required": [
          "name"
        ],
        "additionalProperties": false,
        "properties": {
          "name": {
            "type": "string",
            "description": "The default slot uses an empty string name, per the CEM spec."
          },
          "description": {
            "type": "string"
          },
          "deprecated": {
            "type": [
              "string",
              "boolean"
            ],
            "description": "CEM's own field name. Whether this member is deprecated; a string is the reason. Note CEM has no per-VALUE deprecation, so a legacy value of an enumerated attribute stays described in prose, not marked here."
          },
          "inheritedFrom": {
            "type": "object",
            "description": "CEM's own field name. A Reference to the class that declares this member, as opposed to the component it is documented on. CEM's Reference holds one name, so an intermediate hop stays in the description: `label` on input-password is declared by MozBaseInputElement and reaches it via MozInputText, and only the declaring class goes here. The chain itself is CEM's superclass/mixins on a class declaration, which this schema does not model.",
            "required": [
              "name"
            ],
            "additionalProperties": false,
            "properties": {
              "name": {
                "type": "string",
                "description": "The exported class name, e.g. MozBaseInputElement."
              },
              "module": {
                "type": "string",
                "description": "Path relative to the mozilla-central root."
              },
              "package": {
                "type": "string",
                "description": "Only for a global like HTMLElement, where CEM uses \"global:\"."
              }
            }
          }
        }
      }
    },
    "events": {
      "type": "array",
      "items": {
        "type": "object",
        "required": [
          "name"
        ],
        "additionalProperties": false,
        "properties": {
          "name": {
            "type": "string"
          },
          "description": {
            "type": "string"
          },
          "deprecated": {
            "type": [
              "string",
              "boolean"
            ],
            "description": "CEM's own field name. Whether this member is deprecated; a string is the reason. Note CEM has no per-VALUE deprecation, so a legacy value of an enumerated attribute stays described in prose, not marked here."
          },
          "inheritedFrom": {
            "type": "object",
            "description": "CEM's own field name. A Reference to the class that declares this member, as opposed to the component it is documented on. CEM's Reference holds one name, so an intermediate hop stays in the description: `label` on input-password is declared by MozBaseInputElement and reaches it via MozInputText, and only the declaring class goes here. The chain itself is CEM's superclass/mixins on a class declaration, which this schema does not model.",
            "required": [
              "name"
            ],
            "additionalProperties": false,
            "properties": {
              "name": {
                "type": "string",
                "description": "The exported class name, e.g. MozBaseInputElement."
              },
              "module": {
                "type": "string",
                "description": "Path relative to the mozilla-central root."
              },
              "package": {
                "type": "string",
                "description": "Only for a global like HTMLElement, where CEM uses \"global:\"."
              }
            }
          }
        }
      }
    },
    "methods": {
      "type": "array",
      "items": {
        "type": "object",
        "required": [
          "name"
        ],
        "additionalProperties": false,
        "properties": {
          "name": {
            "type": "string"
          },
          "description": {
            "type": "string"
          },
          "deprecated": {
            "type": [
              "string",
              "boolean"
            ],
            "description": "CEM's own field name. Whether this member is deprecated; a string is the reason. Note CEM has no per-VALUE deprecation, so a legacy value of an enumerated attribute stays described in prose, not marked here."
          },
          "inheritedFrom": {
            "type": "object",
            "description": "CEM's own field name. A Reference to the class that declares this member, as opposed to the component it is documented on. CEM's Reference holds one name, so an intermediate hop stays in the description: `label` on input-password is declared by MozBaseInputElement and reaches it via MozInputText, and only the declaring class goes here. The chain itself is CEM's superclass/mixins on a class declaration, which this schema does not model.",
            "required": [
              "name"
            ],
            "additionalProperties": false,
            "properties": {
              "name": {
                "type": "string",
                "description": "The exported class name, e.g. MozBaseInputElement."
              },
              "module": {
                "type": "string",
                "description": "Path relative to the mozilla-central root."
              },
              "package": {
                "type": "string",
                "description": "Only for a global like HTMLElement, where CEM uses \"global:\"."
              }
            }
          }
        }
      }
    },
    "cssProperties": {
      "type": "array",
      "items": {
        "type": "object",
        "required": [
          "name"
        ],
        "additionalProperties": false,
        "properties": {
          "name": {
            "type": "string"
          },
          "description": {
            "type": "string"
          },
          "default": {
            "type": "string",
            "description": "CEM's own field for this property's real literal value, used here for a property with no backing design token. Omitted, not guessed, when no such real default exists."
          },
          "deprecated": {
            "type": [
              "string",
              "boolean"
            ],
            "description": "CEM's own field name. Whether this member is deprecated; a string is the reason. Note CEM has no per-VALUE deprecation, so a legacy value of an enumerated attribute stays described in prose, not marked here."
          },
          "inheritedFrom": {
            "type": "object",
            "description": "CEM's own field name. A Reference to the class that declares this member, as opposed to the component it is documented on. CEM's Reference holds one name, so an intermediate hop stays in the description: `label` on input-password is declared by MozBaseInputElement and reaches it via MozInputText, and only the declaring class goes here. The chain itself is CEM's superclass/mixins on a class declaration, which this schema does not model.",
            "required": [
              "name"
            ],
            "additionalProperties": false,
            "properties": {
              "name": {
                "type": "string",
                "description": "The exported class name, e.g. MozBaseInputElement."
              },
              "module": {
                "type": "string",
                "description": "Path relative to the mozilla-central root."
              },
              "package": {
                "type": "string",
                "description": "Only for a global like HTMLElement, where CEM uses \"global:\"."
              }
            }
          }
        }
      }
    },
    "cssParts": {
      "type": "array",
      "description": "CEM's own field name. Real `::part()` names found in the component's own shadow-DOM render output (or a shared base class it genuinely extends), for shadow-DOM components only. Acorn is mostly light-DOM by design, so most entries have none.",
      "items": {
        "type": "object",
        "required": [
          "name"
        ],
        "additionalProperties": false,
        "properties": {
          "name": {
            "type": "string"
          },
          "description": {
            "type": "string"
          },
          "deprecated": {
            "type": [
              "string",
              "boolean"
            ],
            "description": "CEM's own field name. Whether this member is deprecated; a string is the reason. Note CEM has no per-VALUE deprecation, so a legacy value of an enumerated attribute stays described in prose, not marked here."
          },
          "inheritedFrom": {
            "type": "object",
            "description": "CEM's own field name. A Reference to the class that declares this member, as opposed to the component it is documented on. CEM's Reference holds one name, so an intermediate hop stays in the description: `label` on input-password is declared by MozBaseInputElement and reaches it via MozInputText, and only the declaring class goes here. The chain itself is CEM's superclass/mixins on a class declaration, which this schema does not model.",
            "required": [
              "name"
            ],
            "additionalProperties": false,
            "properties": {
              "name": {
                "type": "string",
                "description": "The exported class name, e.g. MozBaseInputElement."
              },
              "module": {
                "type": "string",
                "description": "Path relative to the mozilla-central root."
              },
              "package": {
                "type": "string",
                "description": "Only for a global like HTMLElement, where CEM uses \"global:\"."
              }
            }
          }
        }
      }
    },
    "variants": {
      "type": "array",
      "items": {
        "type": "object",
        "required": [
          "axis",
          "values"
        ],
        "additionalProperties": false,
        "properties": {
          "axis": {
            "type": "string"
          },
          "values": {
            "type": "array",
            "items": {
              "type": "string"
            }
          },
          "typedef": {
            "type": "string",
            "description": "Upstream @typedef name for this axis, e.g. MozBadgeType."
          }
        }
      }
    },
    "usage": {
      "type": "string",
      "description": "A realistic, real-attribute usage example. Not a hypothetical."
    }
  }
}
